{
  "repo": {
    "id": "toy",
    "tree": "toy/.git@f5ab7bb69490",
    "sha": "f5ab7bb694900aef2a75e77a2c808b1f43246e8e",
    "manifest": "<manifest>"
  },
  "files": [
    "AGENTS.md",
    "CONTRIBUTING.md"
  ],
  "adapters": [
    "bazel",
    "make",
    "cmake",
    "pytest",
    "pre-commit"
  ],
  "adapters_detected": false,
  "counts": {
    "ok": 28,
    "unresolved": 8,
    "fail": 16,
    "total": 52
  },
  "by_source": {
    "framework": {
      "ok": 26,
      "unresolved": 8,
      "fail": 15,
      "total": 49
    },
    "repository": {
      "ok": 2,
      "unresolved": 0,
      "fail": 1,
      "total": 3
    }
  },
  "by_kind": {
    "bazel_config": {
      "ok": 1,
      "unresolved": 0,
      "fail": 1,
      "total": 2
    },
    "bazel_label": {
      "ok": 5,
      "unresolved": 2,
      "fail": 2,
      "total": 9
    },
    "cmake_var": {
      "ok": 2,
      "unresolved": 0,
      "fail": 1,
      "total": 3
    },
    "identifier": {
      "ok": 1,
      "unresolved": 0,
      "fail": 2,
      "total": 3
    },
    "link": {
      "ok": 2,
      "unresolved": 0,
      "fail": 2,
      "total": 4
    },
    "make_target": {
      "ok": 3,
      "unresolved": 1,
      "fail": 0,
      "total": 4
    },
    "make_var": {
      "ok": 0,
      "unresolved": 0,
      "fail": 1,
      "total": 1
    },
    "path": {
      "ok": 8,
      "unresolved": 2,
      "fail": 2,
      "total": 12
    },
    "precommit_hook": {
      "ok": 1,
      "unresolved": 0,
      "fail": 1,
      "total": 2
    },
    "pytest_node": {
      "ok": 1,
      "unresolved": 0,
      "fail": 1,
      "total": 2
    },
    "pytest_path": {
      "ok": 2,
      "unresolved": 0,
      "fail": 0,
      "total": 2
    },
    "script_path": {
      "ok": 0,
      "unresolved": 1,
      "fail": 0,
      "total": 1
    },
    "shell_fence": {
      "ok": 0,
      "unresolved": 0,
      "fail": 1,
      "total": 1
    },
    "starlark_kwarg": {
      "ok": 0,
      "unresolved": 1,
      "fail": 1,
      "total": 2
    },
    "starlark_macro": {
      "ok": 2,
      "unresolved": 1,
      "fail": 0,
      "total": 3
    },
    "target": {
      "ok": 0,
      "unresolved": 0,
      "fail": 1,
      "total": 1
    }
  },
  "by_file": {
    "AGENTS.md": {
      "ok": 27,
      "unresolved": 8,
      "fail": 16,
      "total": 51
    },
    "CONTRIBUTING.md": {
      "ok": 1,
      "unresolved": 0,
      "fail": 0,
      "total": 1
    }
  },
  "static": {
    "errors": [],
    "claims": 3,
    "superseded": 0,
    "extra": {
      "counts": {
        "fail": 1,
        "ok": 1,
        "ok_basename": 1,
        "unresolved": 0
      },
      "files": [
        "AGENTS.md"
      ]
    }
  },
  "warnings": [],
  "incomplete": false,
  "claims": [
    {
      "file": "AGENTS.md",
      "line": 2,
      "kind": "link",
      "claim": "src/a.h",
      "status": "ok",
      "why": "resolves to src/a.h",
      "ctx": "See [the header](src/a.h), [gone](missing.md), [blob](https://github.com/acme/toy/blob/main/src/a.h),",
      "source": "framework"
    },
    {
      "file": "AGENTS.md",
      "line": 2,
      "kind": "link",
      "claim": "missing.md",
      "status": "fail",
      "why": "resolves to missing.md",
      "ctx": "See [the header](src/a.h), [gone](missing.md), [blob](https://github.com/acme/toy/blob/main/src/a.h),",
      "source": "framework"
    },
    {
      "file": "AGENTS.md",
      "line": 2,
      "kind": "link",
      "claim": "https://github.com/acme/toy/blob/main/src/a.h",
      "status": "ok",
      "why": "resolves to src/a.h",
      "ctx": "See [the header](src/a.h), [gone](missing.md), [blob](https://github.com/acme/toy/blob/main/src/a.h),",
      "source": "framework"
    },
    {
      "file": "AGENTS.md",
      "line": 3,
      "kind": "link",
      "claim": "https://github.com/acme/toy/tree/main/nowhere",
      "status": "fail",
      "why": "resolves to nowhere",
      "ctx": "[blob gone](https://github.com/acme/toy/tree/main/nowhere), [site](https://example.com/x) and [top](#toy).",
      "source": "framework"
    },
    {
      "claim": "a.h",
      "file": "AGENTS.md",
      "kind": "path",
      "line": 3,
      "status": "ok",
      "source": "repository"
    },
    {
      "file": "AGENTS.md",
      "line": 4,
      "kind": "path",
      "claim": "src/a.h",
      "status": "ok",
      "why": "src/a.h",
      "ctx": "Paths: `src/a.h`, `a.h`, `src/*.h`, `docs/*.xyz`, `src/missing.h`, `out/gen.h`, `inner/x.py`, `Makefile`, `<out>/a.h`, `{run_dir}/x.json`.",
      "source": "framework"
    },
    {
      "file": "AGENTS.md",
      "line": 4,
      "kind": "path",
      "claim": "a.h",
      "status": "ok_basename",
      "why": "bare name; 1 match(es), e.g. src/a.h",
      "ctx": "Paths: `src/a.h`, `a.h`, `src/*.h`, `docs/*.xyz`, `src/missing.h`, `out/gen.h`, `inner/x.py`, `Makefile`, `<out>/a.h`, `{run_dir}/x.json`.",
      "source": "framework"
    },
    {
      "file": "AGENTS.md",
      "line": 4,
      "kind": "path",
      "claim": "src/*.h",
      "status": "ok",
      "why": "glob src/*.h -> e.g. src/a.h",
      "ctx": "Paths: `src/a.h`, `a.h`, `src/*.h`, `docs/*.xyz`, `src/missing.h`, `out/gen.h`, `inner/x.py`, `Makefile`, `<out>/a.h`, `{run_dir}/x.json`.",
      "source": "framework"
    },
    {
      "file": "AGENTS.md",
      "line": 4,
      "kind": "path",
      "claim": "docs/*.xyz",
      "status": "fail",
      "why": "glob docs/*.xyz -> 0 hits",
      "ctx": "Paths: `src/a.h`, `a.h`, `src/*.h`, `docs/*.xyz`, `src/missing.h`, `out/gen.h`, `inner/x.py`, `Makefile`, `<out>/a.h`, `{run_dir}/x.json`.",
      "source": "framework"
    },
    {
      "file": "AGENTS.md",
      "line": 4,
      "kind": "path",
      "claim": "src/missing.h",
      "status": "fail",
      "why": "src/ exists but src/missing.h does not",
      "ctx": "Paths: `src/a.h`, `a.h`, `src/*.h`, `docs/*.xyz`, `src/missing.h`, `out/gen.h`, `inner/x.py`, `Makefile`, `<out>/a.h`, `{run_dir}/x.json`.",
      "source": "framework"
    },
    {
      "file": "AGENTS.md",
      "line": 4,
      "kind": "path",
      "claim": "out/gen.h",
      "status": "unresolved",
      "why": "tried out/gen.h",
      "ctx": "Paths: `src/a.h`, `a.h`, `src/*.h`, `docs/*.xyz`, `src/missing.h`, `out/gen.h`, `inner/x.py`, `Makefile`, `<out>/a.h`, `{run_dir}/x.json`.",
      "source": "framework"
    },
    {
      "file": "AGENTS.md",
      "line": 4,
      "kind": "path",
      "claim": "inner/x.py",
      "status": "ok_suffix",
      "why": "below a directory the text does not name; 1 match(es), e.g. deep/inner/x.py",
      "ctx": "Paths: `src/a.h`, `a.h`, `src/*.h`, `docs/*.xyz`, `src/missing.h`, `out/gen.h`, `inner/x.py`, `Makefile`, `<out>/a.h`, `{run_dir}/x.json`.",
      "source": "framework"
    },
    {
      "file": "AGENTS.md",
      "line": 4,
      "kind": "path",
      "claim": "Makefile",
      "status": "ok",
      "why": "Makefile",
      "ctx": "Paths: `src/a.h`, `a.h`, `src/*.h`, `docs/*.xyz`, `src/missing.h`, `out/gen.h`, `inner/x.py`, `Makefile`, `<out>/a.h`, `{run_dir}/x.json`.",
      "source": "framework"
    },
    {
      "file": "AGENTS.md",
      "line": 4,
      "kind": "path",
      "claim": "<out>/a.h",
      "status": "ok",
      "why": "<out> stands for a directory; a.h matches src/a.h",
      "ctx": "Paths: `src/a.h`, `a.h`, `src/*.h`, `docs/*.xyz`, `src/missing.h`, `out/gen.h`, `inner/x.py`, `Makefile`, `<out>/a.h`, `{run_dir}/x.json`.",
      "source": "framework"
    },
    {
      "file": "AGENTS.md",
      "line": 4,
      "kind": "path",
      "claim": "{run_dir}/x.json",
      "status": "unresolved",
      "why": "{run_dir} stands for a directory outside the tree; nothing to check x.json against",
      "ctx": "Paths: `src/a.h`, `a.h`, `src/*.h`, `docs/*.xyz`, `src/missing.h`, `out/gen.h`, `inner/x.py`, `Makefile`, `<out>/a.h`, `{run_dir}/x.json`.",
      "source": "framework"
    },
    {
      "claim": "b.h",
      "file": "AGENTS.md",
      "kind": "path",
      "line": 4,
      "status": "ok_basename",
      "source": "repository"
    },
    {
      "file": "AGENTS.md",
      "line": 5,
      "kind": "identifier",
      "claim": "ToyWidget",
      "status": "ok",
      "why": "`ToyWidget` found in tracked non-doc files",
      "ctx": "Names: `ToyWidget`, `GhostWidget`, `OnlyInDocs`.",
      "source": "framework"
    },
    {
      "file": "AGENTS.md",
      "line": 5,
      "kind": "identifier",
      "claim": "GhostWidget",
      "status": "fail",
      "why": "`GhostWidget` not found in tracked non-doc files",
      "ctx": "Names: `ToyWidget`, `GhostWidget`, `OnlyInDocs`.",
      "source": "framework"
    },
    {
      "file": "AGENTS.md",
      "line": 5,
      "kind": "identifier",
      "claim": "OnlyInDocs",
      "status": "fail",
      "why": "`OnlyInDocs` not found in tracked non-doc files",
      "ctx": "Names: `ToyWidget`, `GhostWidget`, `OnlyInDocs`.",
      "source": "framework"
    },
    {
      "file": "AGENTS.md",
      "line": 6,
      "kind": "bazel_label",
      "claim": "//lib:core",
      "status": "ok",
      "why": "name = \"core\" in lib/BUILD",
      "ctx": "//lib:core",
      "source": "framework"
    },
    {
      "file": "AGENTS.md",
      "line": 6,
      "kind": "bazel_label",
      "claim": "//lib:nope",
      "status": "fail",
      "why": "no target \"nope\" in lib/BUILD",
      "ctx": "//lib:nope",
      "source": "framework"
    },
    {
      "file": "AGENTS.md",
      "line": 6,
      "kind": "bazel_label",
      "claim": "//pkg2:gen_extra",
      "status": "unresolved",
      "why": "no literal name = \"gen_extra\" in pkg2/BUILD; a macro there may generate it",
      "ctx": "//pkg2:gen_extra",
      "source": "framework"
    },
    {
      "file": "AGENTS.md",
      "line": 6,
      "kind": "bazel_label",
      "claim": "//nopkg:x",
      "status": "fail",
      "why": "no BUILD file in package 'nopkg'",
      "ctx": "//nopkg:x",